{
  "entries": [
    {
      "branch": null,
      "gitlink": "d5bf9a16d51fd931c5c4985e77467f887b400c19",
      "parent": ".",
      "path": "src-ui/src/lib/golden_alchemist_ui",
      "url": "https://github.com/Golden-Geek/golden_alchemist_ui.git"
    },
    {
      "branch": null,
      "gitlink": "a85df86fa64eafda9b5a0074b301d390c2bf4579",
      "parent": ".",
      "path": "src-ui/src/lib/golden_ui",
      "url": "https://github.com/Golden-Geek/golden_ui"
    },
    {
      "branch": null,
      "gitlink": "1bfe1c5b15d02068695fff5a71073c8b081f72e0",
      "parent": ".",
      "path": "submodules/golden_alchemist_core",
      "url": "https://github.com/Golden-Geek/golden_alchemist_core.git"
    },
    {
      "branch": null,
      "gitlink": "72de384ca365442773a19563428d1cdb85039509",
      "parent": ".",
      "path": "submodules/golden_core",
      "url": "https://github.com/Golden-Geek/golden_core"
    }
  ],
  "generated_by": {
    "path": "tools/migration/product_manifest.py",
    "version": "1.0.0"
  },
  "manifest_kind": "source_revisions",
  "schema_version": 1
}
